{
  "adapters": [
    {
      "judge_calls": 0,
      "name": "stateless",
      "provider_calls": 0,
      "reason": "deterministic no-memory baseline; it cannot transfer an experience",
      "status": "pass",
      "version": "reference-1"
    },
    {
      "judge_calls": 0,
      "name": "ungoverned_recall",
      "provider_calls": 0,
      "reason": "deterministic plain recall reference; it does not validate provenance or authority",
      "status": "pass",
      "version": "reference-1"
    },
    {
      "judge_calls": 0,
      "name": "perseus_vault_governed",
      "provider_calls": 0,
      "reason": "provider-free governed decision policy over the shared contract view; no Vault process or provider call",
      "status": "pass",
      "version": "reference-1"
    },
    {
      "judge_calls": 0,
      "name": "external_implementation",
      "provider_calls": 0,
      "reason": "external implementation adapter is specified for a separately authorized cross-implementation run; no external code or provider was executed",
      "status": "not_measured",
      "version": "contract-only-1"
    }
  ],
  "case_results": [
    {
      "adapter": "stateless",
      "authority_checked": false,
      "case_id": "vet-01",
      "decision": "abstain",
      "decision_match": false,
      "negative_control": false,
      "provenance_validated": false,
      "reason_code": "no_memory_available",
      "revalidated": false,
      "selected_memory_count": 0,
      "transition_steps": 0,
      "unsafe_reuse": false
    },
    {
      "adapter": "stateless",
      "authority_checked": false,
      "case_id": "vet-02",
      "decision": "abstain",
      "decision_match": false,
      "negative_control": false,
      "provenance_validated": false,
      "reason_code": "no_memory_available",
      "revalidated": false,
      "selected_memory_count": 0,
      "transition_steps": 0,
      "unsafe_reuse": false
    },
    {
      "adapter": "stateless",
      "authority_checked": false,
      "case_id": "vet-03",
      "decision": "abstain",
      "decision_match": false,
      "negative_control": false,
      "provenance_validated": false,
      "reason_code": "no_memory_available",
      "revalidated": false,
      "selected_memory_count": 0,
      "transition_steps": 0,
      "unsafe_reuse": false
    },
    {
      "adapter": "stateless",
      "authority_checked": false,
      "case_id": "vet-04",
      "decision": "abstain",
      "decision_match": false,
      "negative_control": true,
      "provenance_validated": false,
      "reason_code": "no_memory_available",
      "revalidated": false,
      "selected_memory_count": 0,
      "transition_steps": 0,
      "unsafe_reuse": false
    },
    {
      "adapter": "stateless",
      "authority_checked": false,
      "case_id": "vet-05",
      "decision": "abstain",
      "decision_match": false,
      "negative_control": true,
      "provenance_validated": false,
      "reason_code": "no_memory_available",
      "revalidated": false,
      "selected_memory_count": 0,
      "transition_steps": 0,
      "unsafe_reuse": false
    },
    {
      "adapter": "stateless",
      "authority_checked": false,
      "case_id": "vet-06",
      "decision": "abstain",
      "decision_match": false,
      "negative_control": true,
      "provenance_validated": false,
      "reason_code": "no_memory_available",
      "revalidated": false,
      "selected_memory_count": 0,
      "transition_steps": 0,
      "unsafe_reuse": false
    },
    {
      "adapter": "stateless",
      "authority_checked": false,
      "case_id": "vet-07",
      "decision": "abstain",
      "decision_match": false,
      "negative_control": true,
      "provenance_validated": false,
      "reason_code": "no_memory_available",
      "revalidated": false,
      "selected_memory_count": 0,
      "transition_steps": 0,
      "unsafe_reuse": false
    },
    {
      "adapter": "stateless",
      "authority_checked": false,
      "case_id": "vet-08",
      "decision": "abstain",
      "decision_match": false,
      "negative_control": false,
      "provenance_validated": false,
      "reason_code": "no_memory_available",
      "revalidated": false,
      "selected_memory_count": 0,
      "transition_steps": 0,
      "unsafe_reuse": false
    },
    {
      "adapter": "stateless",
      "authority_checked": false,
      "case_id": "vet-09",
      "decision": "abstain",
      "decision_match": false,
      "negative_control": true,
      "provenance_validated": false,
      "reason_code": "no_memory_available",
      "revalidated": false,
      "selected_memory_count": 0,
      "transition_steps": 0,
      "unsafe_reuse": false
    },
    {
      "adapter": "stateless",
      "authority_checked": false,
      "case_id": "vet-10",
      "decision": "abstain",
      "decision_match": false,
      "negative_control": false,
      "provenance_validated": false,
      "reason_code": "no_memory_available",
      "revalidated": false,
      "selected_memory_count": 0,
      "transition_steps": 0,
      "unsafe_reuse": false
    },
    {
      "adapter": "stateless",
      "authority_checked": false,
      "case_id": "vet-11",
      "decision": "abstain",
      "decision_match": false,
      "negative_control": true,
      "provenance_validated": false,
      "reason_code": "no_memory_available",
      "revalidated": false,
      "selected_memory_count": 0,
      "transition_steps": 0,
      "unsafe_reuse": false
    },
    {
      "adapter": "stateless",
      "authority_checked": false,
      "case_id": "vet-12",
      "decision": "abstain",
      "decision_match": false,
      "negative_control": false,
      "provenance_validated": false,
      "reason_code": "no_memory_available",
      "revalidated": false,
      "selected_memory_count": 0,
      "transition_steps": 0,
      "unsafe_reuse": false
    },
    {
      "adapter": "stateless",
      "authority_checked": false,
      "case_id": "vet-13",
      "decision": "abstain",
      "decision_match": true,
      "negative_control": true,
      "provenance_validated": false,
      "reason_code": "no_memory_available",
      "revalidated": false,
      "selected_memory_count": 0,
      "transition_steps": 0,
      "unsafe_reuse": false
    },
    {
      "adapter": "stateless",
      "authority_checked": false,
      "case_id": "vet-14",
      "decision": "abstain",
      "decision_match": true,
      "negative_control": true,
      "provenance_validated": false,
      "reason_code": "no_memory_available",
      "revalidated": false,
      "selected_memory_count": 0,
      "transition_steps": 0,
      "unsafe_reuse": false
    },
    {
      "adapter": "stateless",
      "authority_checked": false,
      "case_id": "vet-15",
      "decision": "abstain",
      "decision_match": false,
      "negative_control": true,
      "provenance_validated": false,
      "reason_code": "no_memory_available",
      "revalidated": false,
      "selected_memory_count": 0,
      "transition_steps": 0,
      "unsafe_reuse": false
    },
    {
      "adapter": "stateless",
      "authority_checked": false,
      "case_id": "vet-16",
      "decision": "abstain",
      "decision_match": true,
      "negative_control": false,
      "provenance_validated": false,
      "reason_code": "no_memory_available",
      "revalidated": false,
      "selected_memory_count": 0,
      "transition_steps": 0,
      "unsafe_reuse": false
    },
    {
      "adapter": "stateless",
      "authority_checked": false,
      "case_id": "vet-17",
      "decision": "abstain",
      "decision_match": false,
      "negative_control": true,
      "provenance_validated": false,
      "reason_code": "no_memory_available",
      "revalidated": false,
      "selected_memory_count": 0,
      "transition_steps": 0,
      "unsafe_reuse": false
    },
    {
      "adapter": "stateless",
      "authority_checked": false,
      "case_id": "vet-18",
      "decision": "abstain",
      "decision_match": false,
      "negative_control": true,
      "provenance_validated": false,
      "reason_code": "no_memory_available",
      "revalidated": false,
      "selected_memory_count": 0,
      "transition_steps": 0,
      "unsafe_reuse": false
    },
    {
      "adapter": "stateless",
      "authority_checked": false,
      "case_id": "vet-19",
      "decision": "abstain",
      "decision_match": false,
      "negative_control": true,
      "provenance_validated": false,
      "reason_code": "no_memory_available",
      "revalidated": false,
      "selected_memory_count": 0,
      "transition_steps": 0,
      "unsafe_reuse": false
    },
    {
      "adapter": "stateless",
      "authority_checked": false,
      "case_id": "vet-20",
      "decision": "abstain",
      "decision_match": false,
      "negative_control": true,
      "provenance_validated": false,
      "reason_code": "no_memory_available",
      "revalidated": false,
      "selected_memory_count": 0,
      "transition_steps": 0,
      "unsafe_reuse": false
    },
    {
      "adapter": "stateless",
      "authority_checked": false,
      "case_id": "vet-21",
      "decision": "abstain",
      "decision_match": true,
      "negative_control": true,
      "provenance_validated": false,
      "reason_code": "no_memory_available",
      "revalidated": false,
      "selected_memory_count": 0,
      "transition_steps": 0,
      "unsafe_reuse": false
    },
    {
      "adapter": "stateless",
      "authority_checked": false,
      "case_id": "vet-22",
      "decision": "abstain",
      "decision_match": true,
      "negative_control": false,
      "provenance_validated": false,
      "reason_code": "no_memory_available",
      "revalidated": false,
      "selected_memory_count": 0,
      "transition_steps": 0,
      "unsafe_reuse": false
    },
    {
      "adapter": "stateless",
      "authority_checked": false,
      "case_id": "vet-23",
      "decision": "abstain",